{
  "schema_version": "1.0.0",
  "sequence": 0,
  "timestamp_ns": 1000000,
  "mode": "LOW_CONFIDENCE",
  "position": {
    "latitude_deg": 12.9716,
    "longitude_deg": 77.5946
  },
  "motion": {
    "speed_mps": 0.0,
    "heading_rad": 0.0
  },
  "uncertainty": {
    "horizontal_95_m": 250.0,
    "heading_95_rad": 3.141592653589793,
    "is_calibrated": false
  },
  "gnss_health": {
    "score": 0.0,
    "last_trusted_fix_age_s": 0.0,
    "risk_flags": ["no_fix"]
  },
  "map_match": {
    "status": "NO_MAP",
    "confidence": 0.0
  },
  "health": {
    "sensor_ok": true,
    "model_ok": false,
    "filter_ok": true,
    "map_ok": false,
    "flags": ["model_absent", "map_absent"]
  },
  "provenance": {
    "core_version": "0.1.0",
    "config_hash": "aaaaaaaaaaaaaaaaaaaaaaaaaaaaaaaaaaaaaaaaaaaaaaaaaaaaaaaaaaaaaaaa"
  }
}
